{
  "profile_id": "q1-50",
  "profile_version": 6,
  "api": {
    "header_bytes": {
      "unit": "bytes",
      "hard_max": 65536,
      "q1_default": 32768,
      "overflow_outcome": "invalid_request"
    },
    "url_bytes": {
      "unit": "bytes",
      "hard_max": 8192,
      "q1_default": 4096,
      "overflow_outcome": "invalid_request"
    },
    "compressed_body_bytes": {
      "unit": "bytes",
      "hard_max": 16777216,
      "q1_default": 4194304,
      "overflow_outcome": "invalid_request"
    },
    "decoded_body_bytes": {
      "unit": "bytes",
      "hard_max": 67108864,
      "q1_default": 16777216,
      "overflow_outcome": "invalid_request"
    },
    "json_depth": {
      "unit": "depth",
      "hard_max": 64,
      "q1_default": 32,
      "overflow_outcome": "invalid_request"
    },
    "json_properties": {
      "unit": "count",
      "hard_max": 4096,
      "q1_default": 1024,
      "overflow_outcome": "invalid_request"
    },
    "json_items": {
      "unit": "items",
      "hard_max": 16384,
      "q1_default": 4096,
      "overflow_outcome": "invalid_request"
    },
    "list_page_items": {
      "unit": "items",
      "hard_max": 500,
      "q1_default": 100,
      "overflow_outcome": "invalid_request"
    },
    "sse_event_bytes": {
      "unit": "bytes",
      "hard_max": 1048576,
      "q1_default": 262144,
      "overflow_outcome": "promote_to_artifact"
    },
    "sse_buffer_events": {
      "unit": "count",
      "hard_max": 512,
      "q1_default": 128,
      "overflow_outcome": "drop_live_then_close"
    },
    "sse_connections_per_tenant": {
      "unit": "connections",
      "hard_max": 1000,
      "q1_default": 200,
      "overflow_outcome": "rate_limited"
    }
  },
  "registry_plan": {
    "draft_bytes": {
      "unit": "bytes",
      "hard_max": 16777216,
      "q1_default": 4194304,
      "overflow_outcome": "invalid_request"
    },
    "package_bytes": {
      "unit": "bytes",
      "hard_max": 536870912,
      "q1_default": 134217728,
      "overflow_outcome": "content_rejected"
    },
    "schema_bytes": {
      "unit": "bytes",
      "hard_max": 4194304,
      "q1_default": 1048576,
      "overflow_outcome": "invalid_request"
    },
    "definitions": {
      "unit": "count",
      "hard_max": 4096,
      "q1_default": 1024,
      "overflow_outcome": "invalid_request"
    },
    "plan_nodes": {
      "unit": "count",
      "hard_max": 10000,
      "q1_default": 2000,
      "overflow_outcome": "invalid_request"
    },
    "plan_edges": {
      "unit": "count",
      "hard_max": 40000,
      "q1_default": 8000,
      "overflow_outcome": "invalid_request"
    },
    "branch_legs": {
      "unit": "count",
      "hard_max": 128,
      "q1_default": 32,
      "overflow_outcome": "invalid_request"
    },
    "expression_instructions": {
      "unit": "count",
      "hard_max": 4096,
      "q1_default": 2048,
      "overflow_outcome": "content_rejected"
    },
    "expression_input_ports": {
      "unit": "count",
      "hard_max": 64,
      "q1_default": 32,
      "overflow_outcome": "content_rejected"
    },
    "expression_stack_depth": {
      "unit": "depth",
      "hard_max": 256,
      "q1_default": 128,
      "overflow_outcome": "content_rejected"
    },
    "map_items": {
      "unit": "items",
      "hard_max": 10000,
      "q1_default": 1000,
      "overflow_outcome": "budget_exhausted"
    },
    "loop_iterations": {
      "unit": "count",
      "hard_max": 10000,
      "q1_default": 1000,
      "overflow_outcome": "budget_exhausted"
    },
    "model_rounds": {
      "unit": "count",
      "hard_max": 256,
      "q1_default": 64,
      "overflow_outcome": "budget_exhausted"
    },
    "dependency_closure": {
      "unit": "count",
      "hard_max": 512,
      "q1_default": 128,
      "overflow_outcome": "invalid_request"
    }
  },
  "run_scheduler": {
    "active_runs_per_tenant": {
      "unit": "count",
      "hard_max": 200,
      "q1_default": 50,
      "overflow_outcome": "quota_exceeded"
    },
    "waiting_runs_per_tenant": {
      "unit": "count",
      "hard_max": 1000,
      "q1_default": 250,
      "overflow_outcome": "quota_exceeded"
    },
    "descendants_per_run": {
      "unit": "count",
      "hard_max": 500,
      "q1_default": 100,
      "overflow_outcome": "budget_exhausted"
    },
    "ready_rows_per_run": {
      "unit": "count",
      "hard_max": 10000,
      "q1_default": 2000,
      "overflow_outcome": "durable_queue"
    },
    "inline_value_bytes": {
      "unit": "bytes",
      "hard_max": 1048576,
      "q1_default": 262144,
      "overflow_outcome": "promote_to_artifact"
    },
    "value_refs_per_run": {
      "unit": "count",
      "hard_max": 100000,
      "q1_default": 20000,
      "overflow_outcome": "budget_exhausted"
    },
    "claim_batch": {
      "unit": "items",
      "hard_max": 256,
      "q1_default": 64,
      "overflow_outcome": "durable_queue"
    },
    "attempts_per_work": {
      "unit": "count",
      "hard_max": 64,
      "q1_default": 8,
      "overflow_outcome": "budget_exhausted"
    },
    "lease_milliseconds": {
      "unit": "milliseconds",
      "hard_max": 120000,
      "q1_default": 30000,
      "overflow_outcome": "deadline_exceeded"
    },
    "heartbeat_milliseconds": {
      "unit": "milliseconds",
      "hard_max": 30000,
      "q1_default": 8000,
      "overflow_outcome": "deadline_exceeded"
    },
    "deferred_poll_base_milliseconds": {
      "unit": "milliseconds",
      "hard_max": 60000,
      "q1_default": 1000,
      "overflow_outcome": "deadline_exceeded"
    },
    "deferred_poll_max_milliseconds": {
      "unit": "milliseconds",
      "hard_max": 3600000,
      "q1_default": 300000,
      "overflow_outcome": "deadline_exceeded"
    },
    "wake_contracts_per_run": {
      "unit": "count",
      "hard_max": 1024,
      "q1_default": 256,
      "overflow_outcome": "budget_exhausted"
    },
    "interactions_per_run": {
      "unit": "count",
      "hard_max": 128,
      "q1_default": 32,
      "overflow_outcome": "quota_exceeded"
    }
  },
  "model_context_mcp": {
    "request_bytes": {
      "unit": "bytes",
      "hard_max": 16777216,
      "q1_default": 4194304,
      "overflow_outcome": "promote_to_artifact"
    },
    "response_bytes": {
      "unit": "bytes",
      "hard_max": 16777216,
      "q1_default": 4194304,
      "overflow_outcome": "promote_to_artifact"
    },
    "delta_bytes": {
      "unit": "bytes",
      "hard_max": 1048576,
      "q1_default": 262144,
      "overflow_outcome": "drop_live_then_close"
    },
    "tokens_per_turn": {
      "unit": "tokens",
      "hard_max": 1000000,
      "q1_default": 131072,
      "overflow_outcome": "budget_exhausted"
    },
    "tool_calls_per_turn": {
      "unit": "count",
      "hard_max": 128,
      "q1_default": 32,
      "overflow_outcome": "budget_exhausted"
    },
    "context_candidates": {
      "unit": "items",
      "hard_max": 1000,
      "q1_default": 200,
      "overflow_outcome": "quota_exceeded"
    },
    "context_items": {
      "unit": "items",
      "hard_max": 500,
      "q1_default": 100,
      "overflow_outcome": "quota_exceeded"
    },
    "context_pages": {
      "unit": "count",
      "hard_max": 100,
      "q1_default": 20,
      "overflow_outcome": "quota_exceeded"
    },
    "mcp_sessions_per_tenant": {
      "unit": "connections",
      "hard_max": 200,
      "q1_default": 50,
      "overflow_outcome": "quota_exceeded"
    },
    "mcp_tasks_per_session": {
      "unit": "count",
      "hard_max": 100,
      "q1_default": 20,
      "overflow_outcome": "quota_exceeded"
    },
    "mcp_subscriptions_per_session": {
      "unit": "count",
      "hard_max": 1000,
      "q1_default": 200,
      "overflow_outcome": "quota_exceeded"
    }
  },
  "capability_sandbox": {
    "input_bytes": {
      "unit": "bytes",
      "hard_max": 67108864,
      "q1_default": 16777216,
      "overflow_outcome": "promote_to_artifact"
    },
    "runtime_bundle_bytes": {
      "unit": "bytes",
      "hard_max": 67108864,
      "q1_default": 33554432,
      "overflow_outcome": "content_rejected"
    },
    "output_bytes": {
      "unit": "bytes",
      "hard_max": 268435456,
      "q1_default": 67108864,
      "overflow_outcome": "promote_to_artifact"
    },
    "progress_events": {
      "unit": "count",
      "hard_max": 10000,
      "q1_default": 1000,
      "overflow_outcome": "drop_live_then_close"
    },
    "queue_depth": {
      "unit": "count",
      "hard_max": 10000,
      "q1_default": 1000,
      "overflow_outcome": "durable_queue"
    },
    "cpu_millicores": {
      "unit": "millicpu",
      "hard_max": 8000,
      "q1_default": 2000,
      "overflow_outcome": "quota_exceeded"
    },
    "memory_mebibytes": {
      "unit": "mebibytes",
      "hard_max": 16384,
      "q1_default": 2048,
      "overflow_outcome": "quota_exceeded"
    },
    "pids": {
      "unit": "pids",
      "hard_max": 4096,
      "q1_default": 256,
      "overflow_outcome": "quota_exceeded"
    },
    "files": {
      "unit": "files",
      "hard_max": 100000,
      "q1_default": 10000,
      "overflow_outcome": "content_rejected"
    },
    "io_bytes": {
      "unit": "bytes",
      "hard_max": 4294967296,
      "q1_default": 536870912,
      "overflow_outcome": "quota_exceeded"
    },
    "wall_seconds": {
      "unit": "seconds",
      "hard_max": 3600,
      "q1_default": 300,
      "overflow_outcome": "deadline_exceeded"
    },
    "cleanup_seconds": {
      "unit": "seconds",
      "hard_max": 300,
      "q1_default": 30,
      "overflow_outcome": "deadline_exceeded"
    }
  },
  "artifact": {
    "single_bytes": {
      "unit": "bytes",
      "hard_max": 1073741824,
      "q1_default": 104857600,
      "overflow_outcome": "content_rejected"
    },
    "tenant_total_bytes": {
      "unit": "bytes",
      "hard_max": 1099511627776,
      "q1_default": 107374182400,
      "overflow_outcome": "quota_exceeded"
    },